Имена,Цена старая,Цена новая,Ссылки
Серебряный браслет с сапфирами и фианитами с позолотой,3980,3582,/catalog/products/2817280/
Серебряный браслет с малахитом и фианитами с позолотой,7660,6894,/catalog/products/1861830/
Серебряный браслет с топазами и фианитами с позолотой,3880,3492,/catalog/products/4058321/
"Серебряный браслет с янтарем и позолотой, р.18-20",4660,4194,/catalog/products/2215958/
Серебряный браслет с топазами Swiss и фианитами с позолотой,3900,3510,/catalog/products/3947965/
"Серебряный браслет с янтарем и позолотой, р.16-18",4360,3924,/catalog/products/2215957/
Серебряный браслет с топазами Swiss и фианитами с родированием,4060,3654,/catalog/products/3442861/
Браслет из жемчуга с золотыми шариками,6440,5796,/catalog/products/4053217/
Серебряный браслет с сапфирами и фианитами с родированием,2040,1836,/catalog/products/2591769/
Серебряный браслет с топазами и фианитами с родированием,8100,7290,/catalog/products/4703506/
Золотой браслет с топазами,25480,22932,/catalog/products/6008610/
Браслет из жемчуга с золотыми шариками,6360,5724,/catalog/products/2000698/
Золотой браслет с бриллиантами и родированием,77440,69696,/catalog/products/5960668/
Серебряный браслет с аметистами и фианитами с родированием,6340,5706,/catalog/products/2004047/
Браслет из жемчуга с золотыми шариками,6080,5472,/catalog/products/2000702/
Браслет из жемчуга с золотым замком,4700,4230,/catalog/products/4315077/
Браслет из жемчуга с золотым замком,0,5330,/catalog/products/2010495/
Золотой браслет с бриллиантами и родированием,36360,32724,/catalog/products/7653817/
Серебряный браслет с ониксом и родированием,1880,1692,/catalog/products/1914373/
Золотой браслет Клевер с бирюзой,19220,17298,/catalog/products/1928360/
Серебряный браслет с топазами и фианитами с позолотой,4800,4320,/catalog/products/4018580/
Серебряный браслет с гранатом и родированием,0,7174,/catalog/products/3781866/
Серебряный браслет с марказитами и чернением,0,6990,/catalog/products/1551424/
Серебряный браслет с ювелирным стеклом и родированием,0,3390,/catalog/products/1090591/
